{
  "version": 1,
  "scan": {
    "maxDepth": 10,
    "skipUnderHome": [
      "Library",
      "Applications",
      "Pictures",
      "Movies",
      "Music",
      "Public",
      ".Trash"
    ],
    "skipAnywhere": [
      ".git",
      ".Spotlight-V100",
      ".fseventsd",
      ".npm",
      ".cache",
      ".yarn",
      ".pnpm-store",
      ".bun",
      ".docker",
      ".ollama",
      ".conda",
      ".anaconda",
      ".cocoapods",
      ".cargo",
      ".rustup",
      ".oh-my-zsh",
      ".zsh_sessions",
      ".vscode",
      ".cursor",
      ".windsurf",
      ".local",
      ".config",
      "Wallpapers"
    ],
    "skipPackageExtensions": [
      ".app",
      ".xcodeproj",
      ".xcworkspace",
      ".photoslibrary",
      ".framework",
      ".appex"
    ]
  },
  "colors": [
    "green",
    "mint",
    "orange",
    "red",
    "brown",
    "yellow",
    "teal",
    "blue",
    "purple",
    "cyan",
    "pink",
    "gray"
  ],
  "types": [
    {
      "id": "node",
      "kind": "project",
      "displayName": "Node Modules",
      "description": "JavaScript dependencies",
      "nameFrom": "packageJson",
      "defaultEnabled": true,
      "regenerable": true,
      "reinstallHint": "npm install",
      "color": "green",
      "icon": "shippingbox",
      "targets": [
        "node_modules"
      ],
      "siblings": []
    },
    {
      "id": "next",
      "kind": "project",
      "displayName": "Next.js Build",
      "description": "Next.js build output",
      "nameFrom": "packageJson",
      "defaultEnabled": true,
      "regenerable": true,
      "reinstallHint": "next build",
      "color": "mint",
      "icon": "n.square",
      "targets": [
        ".next"
      ],
      "siblings": [
        "next.config.js",
        "next.config.mjs",
        "next.config.ts",
        "package.json"
      ]
    },
    {
      "id": "nuxt",
      "kind": "project",
      "displayName": "Nuxt Build",
      "description": "Nuxt build output",
      "nameFrom": "packageJson",
      "defaultEnabled": true,
      "regenerable": true,
      "reinstallHint": "nuxt build",
      "color": "mint",
      "icon": "leaf.fill",
      "targets": [
        ".nuxt",
        ".output"
      ],
      "siblings": [
        "nuxt.config.js",
        "nuxt.config.ts",
        "nuxt.config.mjs"
      ]
    },
    {
      "id": "sveltekit",
      "kind": "project",
      "displayName": "SvelteKit Build",
      "description": "SvelteKit build output",
      "nameFrom": "packageJson",
      "defaultEnabled": true,
      "regenerable": true,
      "reinstallHint": "vite build",
      "color": "mint",
      "icon": "flame",
      "targets": [
        ".svelte-kit"
      ],
      "siblings": [
        "svelte.config.js",
        "svelte.config.mjs",
        "svelte.config.ts"
      ]
    },
    {
      "id": "astro",
      "kind": "project",
      "displayName": "Astro Build",
      "description": "Astro build cache",
      "nameFrom": "packageJson",
      "defaultEnabled": true,
      "regenerable": true,
      "reinstallHint": "astro build",
      "color": "mint",
      "icon": "sparkles",
      "targets": [
        ".astro"
      ],
      "siblings": [
        "astro.config.mjs",
        "astro.config.js",
        "astro.config.ts"
      ]
    },
    {
      "id": "angular",
      "kind": "project",
      "displayName": "Angular Cache",
      "description": "Angular CLI cache",
      "nameFrom": "packageJson",
      "defaultEnabled": true,
      "regenerable": true,
      "reinstallHint": "ng build",
      "color": "mint",
      "icon": "a.square",
      "targets": [
        ".angular"
      ],
      "siblings": [
        "angular.json"
      ]
    },
    {
      "id": "turbo",
      "kind": "project",
      "displayName": "Turbo Cache",
      "description": "Turborepo task cache",
      "nameFrom": "packageJson",
      "defaultEnabled": true,
      "regenerable": true,
      "reinstallHint": "auto-regenerated on next turbo run",
      "color": "mint",
      "icon": "bolt",
      "targets": [
        ".turbo"
      ],
      "siblings": [
        "turbo.json",
        "package.json"
      ]
    },
    {
      "id": "parcel",
      "kind": "project",
      "displayName": "Parcel Cache",
      "description": "Parcel bundler cache",
      "nameFrom": "packageJson",
      "defaultEnabled": true,
      "regenerable": true,
      "reinstallHint": "auto-regenerated on next build",
      "color": "mint",
      "icon": "shippingbox.fill",
      "targets": [
        ".parcel-cache"
      ],
      "siblings": [
        "package.json"
      ]
    },
    {
      "id": "swiftpm",
      "kind": "project",
      "displayName": "Swift PM",
      "description": "Swift Package Manager build artifacts",
      "nameFrom": "packageSwift",
      "defaultEnabled": true,
      "regenerable": true,
      "reinstallHint": "swift build",
      "color": "orange",
      "icon": "swift",
      "targets": [
        ".build"
      ],
      "siblings": [
        "Package.swift"
      ]
    },
    {
      "id": "cocoapods",
      "kind": "project",
      "displayName": "CocoaPods",
      "description": "CocoaPods dependencies",
      "nameFrom": "parentDirname",
      "defaultEnabled": true,
      "regenerable": true,
      "reinstallHint": "pod install",
      "color": "red",
      "icon": "leaf",
      "targets": [
        "Pods"
      ],
      "siblings": [
        "Podfile"
      ]
    },
    {
      "id": "rust",
      "kind": "project",
      "displayName": "Rust",
      "description": "Rust build artifacts",
      "nameFrom": "cargoToml",
      "defaultEnabled": true,
      "regenerable": true,
      "reinstallHint": "cargo build",
      "color": "brown",
      "icon": "gearshape.2",
      "targets": [
        "target"
      ],
      "siblings": [
        "Cargo.toml"
      ]
    },
    {
      "id": "pythonvenv",
      "kind": "project",
      "displayName": "Python Venv",
      "description": "Python virtual environments",
      "nameFrom": "parentDirname",
      "defaultEnabled": true,
      "regenerable": true,
      "reinstallHint": "python -m venv venv",
      "color": "yellow",
      "icon": "terminal",
      "targets": [
        "venv",
        ".venv"
      ],
      "siblings": [
        "requirements.txt",
        "pyproject.toml",
        "setup.py",
        "setup.cfg",
        "Pipfile"
      ]
    },
    {
      "id": "pycache",
      "kind": "project",
      "displayName": "Python Cache",
      "description": "Python bytecode cache",
      "nameFrom": "parentDirname",
      "defaultEnabled": true,
      "regenerable": true,
      "reinstallHint": "auto-regenerated on next run",
      "color": "yellow",
      "icon": "memorychip",
      "targets": [
        "__pycache__"
      ],
      "siblings": []
    },
    {
      "id": "pytestcache",
      "kind": "project",
      "displayName": "Pytest Cache",
      "description": "pytest test result cache",
      "nameFrom": "parentDirname",
      "defaultEnabled": true,
      "regenerable": true,
      "reinstallHint": "auto-regenerated on next test run",
      "color": "yellow",
      "icon": "checkmark.seal",
      "targets": [
        ".pytest_cache"
      ],
      "siblings": []
    },
    {
      "id": "mypycache",
      "kind": "project",
      "displayName": "Mypy Cache",
      "description": "mypy type-check cache",
      "nameFrom": "parentDirname",
      "defaultEnabled": true,
      "regenerable": true,
      "reinstallHint": "auto-regenerated on next mypy run",
      "color": "yellow",
      "icon": "checkmark.shield",
      "targets": [
        ".mypy_cache"
      ],
      "siblings": []
    },
    {
      "id": "ruffcache",
      "kind": "project",
      "displayName": "Ruff Cache",
      "description": "Ruff linter cache",
      "nameFrom": "parentDirname",
      "defaultEnabled": true,
      "regenerable": true,
      "reinstallHint": "auto-regenerated on next ruff run",
      "color": "yellow",
      "icon": "wand.and.stars",
      "targets": [
        ".ruff_cache"
      ],
      "siblings": []
    },
    {
      "id": "tox",
      "kind": "project",
      "displayName": "Tox Cache",
      "description": "Tox virtualenv cache",
      "nameFrom": "parentDirname",
      "defaultEnabled": true,
      "regenerable": true,
      "reinstallHint": "auto-regenerated on next tox run",
      "color": "yellow",
      "icon": "testtube.2",
      "targets": [
        ".tox"
      ],
      "siblings": [
        "tox.ini",
        "pyproject.toml"
      ]
    },
    {
      "id": "gradle",
      "kind": "project",
      "displayName": "Gradle Build",
      "description": "Gradle/Android build outputs",
      "nameFrom": "gradleSettings",
      "defaultEnabled": true,
      "regenerable": true,
      "reinstallHint": "./gradlew build",
      "color": "teal",
      "icon": "hammer",
      "targets": [
        "build"
      ],
      "siblings": [
        "build.gradle",
        "build.gradle.kts"
      ]
    },
    {
      "id": "gradlecache",
      "kind": "project",
      "displayName": "Gradle Cache",
      "description": "Gradle project-level cache",
      "nameFrom": "gradleSettings",
      "defaultEnabled": true,
      "regenerable": true,
      "reinstallHint": "auto-regenerated on next build",
      "color": "teal",
      "icon": "archivebox",
      "targets": [
        ".gradle"
      ],
      "siblings": [
        "build.gradle",
        "build.gradle.kts",
        "settings.gradle",
        "settings.gradle.kts"
      ]
    },
    {
      "id": "xcode-derived",
      "kind": "system",
      "displayName": "Xcode DerivedData",
      "description": "Xcode build artifacts",
      "nameFrom": "derivedData",
      "defaultEnabled": true,
      "regenerable": true,
      "reinstallHint": "Xcode rebuilds automatically",
      "color": "blue",
      "icon": "xmark.bin",
      "path": "~/Library/Developer/Xcode/DerivedData",
      "pathOverrides": [],
      "expand": true,